{
  "$schema": "https://json-schema.org/draft/2020-12/schema",
  "title": "TIA-Guard Round-trip Source v1 manifest",
  "type": "object",
  "required": [
    "schemaVersion",
    "contractStatus",
    "tiaVersion",
    "project",
    "roundTripReady",
    "hardware",
    "plcs",
    "capabilities",
    "diagnostics"
  ],
  "properties": {
    "schemaVersion": { "const": "1.0" },
    "contractStatus": { "const": "draft" },
    "tiaVersion": { "type": "string" },
    "project": {
      "type": "object",
      "required": ["name"],
      "properties": {
        "name": { "type": "string", "minLength": 1 },
        "projectVersion": { "type": ["string", "null"] }
      },
      "additionalProperties": false
    },
    "roundTripReady": { "type": "boolean" },
    "hardware": {
      "type": "array",
      "items": { "type": "string", "pattern": "^tia/hardware/.+\\.json$" }
    },
    "plcs": {
      "type": "array",
      "items": { "type": "string", "pattern": "^tia/plc/.+/plc\\.json$" }
    },
    "capabilities": {
      "type": "array",
      "items": {
        "type": "object",
        "required": ["objectKind", "objectRef", "state"],
        "properties": {
          "objectKind": { "type": "string", "minLength": 1 },
          "objectRef": { "type": "string", "minLength": 1 },
          "state": {
            "enum": [
              "supported-round-trip",
              "export-only",
              "opaque",
              "unsupported",
              "failed"
            ]
          },
          "reason": { "type": ["string", "null"] }
        },
        "additionalProperties": false
      }
    },
    "diagnostics": {
      "type": "array",
      "items": {
        "type": "object",
        "required": ["code", "message"],
        "properties": {
          "code": { "type": "string", "minLength": 1 },
          "message": { "type": "string", "minLength": 1 },
          "objectRef": { "type": ["string", "null"] }
        },
        "additionalProperties": false
      }
    }
  },
  "additionalProperties": false
}
