{"schemaVersion":"1.0","contractStatus":"draft","tiaVersion":"V21","project":{"name":"Demo","projectVersion":null},"roundTripReady":true,"hardware":["tia/hardware/station-a.json"],"plcs":["tia/plc/plc-a/plc.json"],"capabilities":[{"objectKind":"hardware","objectRef":"station-a","state":"supported-round-trip","reason":null},{"objectKind":"plc","objectRef":"plc-a","state":"supported-round-trip","reason":null},{"objectKind":"block","objectRef":"block-a","state":"supported-round-trip","reason":null},{"objectKind":"tag-table","objectRef":"table-a","state":"supported-round-trip","reason":null},{"objectKind":"tag","objectRef":"tag-a","state":"supported-round-trip","reason":null}],"diagnostics":[]}